No.,Time,Source,Destination,Protocol,Length,Info,RTT
63,10.24770435,10.42.0.250,13.211.139.52,HTTP/JSON,63,"POST /data HTTP/1.1 , JavaScript Object Notation (application/json)",
64,10.42095871,13.211.139.52,10.42.0.250,TCP,54,3000  >  53522 [ACK] Seq=1 Ack=214 Win=62514 Len=0,0.173254359
65,10.80705551,13.211.139.52,10.42.0.250,HTTP/JSON,446,"HTTP/1.1 200 OK , JavaScript Object Notation (application/json)",
67,10.99813057,10.42.0.250,13.211.139.52,TCP,54,53522  >  3000 [ACK] Seq=214 Ack=393 Win=5368 Len=0,0.191075055
68,11.18177997,54.253.71.217,10.42.0.250,TCP,54,8883  >  53521 [ACK] Seq=5606 Ack=1713 Win=30660 Len=0,0.304598932
72,12.40816353,13.237.245.123,10.42.0.250,TCP,54,"8883  >  64424 [FIN, ACK] Seq=8 Ack=1 Win=45552 Len=0",
73,12.49593295,10.42.0.250,13.237.245.123,TCP,54,"64424  >  8883 [RST, ACK] Seq=1 Ack=8 Win=32790 Len=0",0.087788414
74,12.49655054,10.42.0.250,13.237.245.123,TCP,54,"64424  >  8883 [RST, ACK] Seq=1 Ack=9 Win=32790 Len=0",0.088387018
75,12.89310351,10.42.0.250,13.211.139.52,TCP,258,"53522  >  3000 [PSH, ACK] Seq=214 Ack=393 Win=5368 Len=204 [TCP segment of a reassembled PDU]",
76,13.7296577,13.211.139.52,10.42.0.250,TCP,54,3000  >  53522 [ACK] Seq=393 Ack=418 Win=62310 Len=0,0.836554198
77,13.92953558,10.42.0.250,13.211.139.52,HTTP/JSON,63,"POST /data HTTP/1.1 , JavaScript Object Notation (application/json)",
78,14.17034159,13.211.139.52,10.42.0.250,TCP,54,3000  >  53522 [ACK] Seq=393 Ack=427 Win=62301 Len=0,0.240806011
79,14.17036291,13.211.139.52,10.42.0.250,HTTP/JSON,446,"HTTP/1.1 200 OK , JavaScript Object Notation (application/json)",
81,14.5027713,10.42.0.250,13.211.139.52,TCP,54,53522  >  3000 [ACK] Seq=427 Ack=785 Win=4976 Len=0,0.332408396
82,14.57930537,54.253.71.217,10.42.0.250,TCP,54,8883  >  53521 [ACK] Seq=5606 Ack=1764 Win=30660 Len=0,0.223809483
83,16.36904374,10.42.0.250,13.211.139.52,TCP,258,"53522  >  3000 [PSH, ACK] Seq=427 Ack=785 Win=4976 Len=204 [TCP segment of a reassembled PDU]",
84,16.55723991,13.211.139.52,10.42.0.250,TCP,54,3000  >  53522 [ACK] Seq=785 Ack=631 Win=62097 Len=0,0.18819617
85,16.59191928,10.42.0.250,13.211.139.52,HTTP/JSON,63,"POST /data HTTP/1.1 , JavaScript Object Notation (application/json)",
86,17.06591596,13.211.139.52,10.42.0.250,TCP,54,3000  >  53522 [ACK] Seq=785 Ack=640 Win=62088 Len=0,0.47399668
87,17.10274139,13.211.139.52,10.42.0.250,HTTP/JSON,446,"HTTP/1.1 200 OK , JavaScript Object Notation (application/json)",
89,17.25093743,10.42.0.250,13.211.139.52,TCP,54,53522  >  3000 [ACK] Seq=640 Ack=1177 Win=4584 Len=0,0.148196039
90,17.44135202,54.253.71.217,10.42.0.250,TCP,54,8883  >  53521 [ACK] Seq=5606 Ack=1815 Win=30660 Len=0,0.217481644
91,19.23755382,10.42.0.250,13.211.139.52,TCP,258,"53522  >  3000 [PSH, ACK] Seq=640 Ack=1177 Win=4584 Len=204 [TCP segment of a reassembled PDU]",
92,19.42389071,13.211.139.52,10.42.0.250,TCP,54,3000  >  53522 [ACK] Seq=1177 Ack=844 Win=61884 Len=0,0.186336891
93,19.45923461,10.42.0.250,13.211.139.52,HTTP/JSON,63,"POST /data HTTP/1.1 , JavaScript Object Notation (application/json)",
94,19.63291392,13.211.139.52,10.42.0.250,TCP,54,3000  >  53522 [ACK] Seq=1177 Ack=853 Win=61875 Len=0,0.173679314
95,19.68379073,13.211.139.52,10.42.0.250,HTTP/JSON,446,"HTTP/1.1 200 OK , JavaScript Object Notation (application/json)",
96,19.68991191,10.42.0.250,13.211.139.52,TCP,54,53522  >  3000 [ACK] Seq=853 Ack=1569 Win=5760 Len=0,0.006121182
98,19.88089716,54.253.71.217,10.42.0.250,TCP,54,8883  >  53521 [ACK] Seq=5606 Ack=1866 Win=30660 Len=0,0.178551288
99,21.71625154,10.42.0.250,13.211.139.52,TCP,258,"53522  >  3000 [PSH, ACK] Seq=853 Ack=1569 Win=5760 Len=204 [TCP segment of a reassembled PDU]",
100,21.89037734,13.211.139.52,10.42.0.250,TCP,54,3000  >  53522 [ACK] Seq=1569 Ack=1057 Win=61671 Len=0,0.174125806
101,21.91766917,10.42.0.250,13.211.139.52,HTTP/JSON,63,"POST /data HTTP/1.1 , JavaScript Object Notation (application/json)",
102,22.09151205,13.211.139.52,10.42.0.250,TCP,54,3000  >  53522 [ACK] Seq=1569 Ack=1066 Win=61662 Len=0,0.173842881
103,22.12621131,13.211.139.52,10.42.0.250,HTTP/JSON,446,"HTTP/1.1 200 OK , JavaScript Object Notation (application/json)",
105,22.24998994,10.42.0.250,13.211.139.52,TCP,54,53522  >  3000 [ACK] Seq=1066 Ack=1961 Win=5368 Len=0,0.123778638
106,22.32465235,54.253.71.217,10.42.0.250,TCP,54,8883  >  53521 [ACK] Seq=5606 Ack=1917 Win=30660 Len=0,0.173479574
107,24.17610654,10.42.0.250,13.211.139.52,TCP,258,"53522  >  3000 [PSH, ACK] Seq=1066 Ack=1961 Win=5368 Len=204 [TCP segment of a reassembled PDU]",
108,24.39097913,13.211.139.52,10.42.0.250,TCP,54,3000  >  53522 [ACK] Seq=1961 Ack=1270 Win=61458 Len=0,0.214872591
109,24.47680655,10.42.0.250,13.211.139.52,HTTP/JSON,63,"POST /data HTTP/1.1 , JavaScript Object Notation (application/json)",
110,24.65290986,13.211.139.52,10.42.0.250,TCP,54,3000  >  53522 [ACK] Seq=1961 Ack=1279 Win=61449 Len=0,0.176103309
111,24.70141194,13.211.139.52,10.42.0.250,HTTP/JSON,446,"HTTP/1.1 200 OK , JavaScript Object Notation (application/json)",
113,24.75066528,10.42.0.250,13.211.139.52,TCP,54,53522  >  3000 [ACK] Seq=1279 Ack=2353 Win=4976 Len=0,0.04925334
114,24.89693101,54.253.71.217,10.42.0.250,TCP,54,8883  >  53521 [ACK] Seq=5606 Ack=1968 Win=30660 Len=0,0.178185118
115,26.73215181,10.42.0.250,13.211.139.52,TCP,258,"53522  >  3000 [PSH, ACK] Seq=1279 Ack=2353 Win=4976 Len=204 [TCP segment of a reassembled PDU]",
116,26.90636371,13.211.139.52,10.42.0.250,TCP,54,3000  >  53522 [ACK] Seq=2353 Ack=1483 Win=61245 Len=0,0.174211901
117,27.04431011,10.42.0.250,13.211.139.52,HTTP/JSON,63,"POST /data HTTP/1.1 , JavaScript Object Notation (application/json)",
118,27.2336049,13.211.139.52,10.42.0.250,TCP,54,3000  >  53522 [ACK] Seq=2353 Ack=1492 Win=61236 Len=0,0.189294792
119,27.46756645,13.211.139.52,10.42.0.250,HTTP/JSON,446,"HTTP/1.1 200 OK , JavaScript Object Notation (application/json)",
121,27.75104186,10.42.0.250,13.211.139.52,TCP,54,53522  >  3000 [ACK] Seq=1492 Ack=2745 Win=4584 Len=0,0.283475403
122,28.04549891,54.253.71.217,10.42.0.250,TCP,54,8883  >  53521 [ACK] Seq=5606 Ack=2019 Win=30660 Len=0,0.377683376
124,29.68237699,10.42.0.250,13.211.139.52,TCP,258,"53522  >  3000 [PSH, ACK] Seq=1492 Ack=2745 Win=4584 Len=204 [TCP segment of a reassembled PDU]",
125,30.03717415,54.253.71.217,10.42.0.250,TCP,54,8883  >  53521 [ACK] Seq=5606 Ack=2050 Win=30660 Len=0,0.35722906
127,30.03721161,13.211.139.52,10.42.0.250,TCP,54,3000  >  53522 [ACK] Seq=2745 Ack=1696 Win=61032 Len=0,0.354834616
128,30.10900572,10.42.0.250,13.211.139.52,HTTP/JSON,63,"POST /data HTTP/1.1 , JavaScript Object Notation (application/json)",
129,30.2520937,10.42.0.250,54.253.71.217,TCP,54,53521  >  8883 [ACK] Seq=2050 Ack=5637 Win=5248 Len=0,0.214888325
130,30.44700802,13.211.139.52,10.42.0.250,TCP,54,3000  >  53522 [ACK] Seq=2745 Ack=1705 Win=61023 Len=0,0.338002291
131,30.44705219,13.211.139.52,10.42.0.250,HTTP/JSON,446,"HTTP/1.1 200 OK , JavaScript Object Notation (application/json)",
132,30.49220341,54.253.71.217,10.42.0.250,TCP,85,"[TCP Spurious Retransmission] 8883  >  53521 [PSH, ACK] Seq=5606 Ack=2050 Win=30660 Len=31",
133,30.5178742,10.42.0.250,54.253.71.217,TCP,54,[TCP Dup ACK 129#1] 53521  >  8883 [ACK] Seq=2050 Ack=5637 Win=5248 Len=0,0.025670792
134,30.52299709,10.42.0.250,13.211.139.52,TCP,54,53522  >  3000 [ACK] Seq=1705 Ack=3137 Win=5760 Len=0,0.075944903
136,30.8558272,54.253.71.217,10.42.0.250,TCP,54,8883  >  53521 [ACK] Seq=5637 Ack=2101 Win=30660 Len=0,0.3175649
137,32.55511176,10.42.0.250,13.211.139.52,TCP,258,"53522  >  3000 [PSH, ACK] Seq=1705 Ack=3137 Win=5760 Len=204 [TCP segment of a reassembled PDU]",
140,32.93849145,13.211.139.52,10.42.0.250,TCP,54,3000  >  53522 [ACK] Seq=3137 Ack=1909 Win=60819 Len=0,0.383379698
141,32.97727455,10.42.0.250,13.211.139.52,HTTP/JSON,63,"POST /data HTTP/1.1 , JavaScript Object Notation (application/json)",
142,33.15033677,13.211.139.52,10.42.0.250,TCP,54,3000  >  53522 [ACK] Seq=3137 Ack=1918 Win=60810 Len=0,0.173062219
143,33.18408119,13.211.139.52,10.42.0.250,HTTP/JSON,446,"HTTP/1.1 200 OK , JavaScript Object Notation (application/json)",
145,33.25280543,10.42.0.250,13.211.139.52,TCP,54,53522  >  3000 [ACK] Seq=1918 Ack=3529 Win=5368 Len=0,0.06872424
146,33.38311282,54.253.71.217,10.42.0.250,TCP,54,8883  >  53521 [ACK] Seq=5637 Ack=2152 Win=30660 Len=0,0.176682046
148,35.21987314,10.42.0.250,13.211.139.52,TCP,259,"53522  >  3000 [PSH, ACK] Seq=1918 Ack=3529 Win=5368 Len=205 [TCP segment of a reassembled PDU]",
149,35.44694583,13.211.139.52,10.42.0.250,TCP,54,3000  >  53522 [ACK] Seq=3529 Ack=2123 Win=60605 Len=0,0.227072685
150,35.63827216,10.42.0.250,13.211.139.52,HTTP/JSON,121,"POST /data HTTP/1.1 , JavaScript Object Notation (application/json)",
151,35.81291412,13.211.139.52,10.42.0.250,TCP,54,3000  >  53522 [ACK] Seq=3529 Ack=2190 Win=60538 Len=0,0.174641963
154,35.86620873,13.211.139.52,10.42.0.250,HTTP/JSON,446,"HTTP/1.1 200 OK , JavaScript Object Notation (application/json)",
160,36.00665732,10.42.0.250,13.211.139.52,TCP,54,53522  >  3000 [ACK] Seq=2190 Ack=3921 Win=4976 Len=0,0.140448586
161,36.0612091,54.253.71.217,10.42.0.250,TCP,54,8883  >  53521 [ACK] Seq=5637 Ack=2261 Win=30660 Len=0,0.174266333
166,37.89850443,10.42.0.250,13.211.139.52,TCP,259,"53522  >  3000 [PSH, ACK] Seq=2190 Ack=3921 Win=4976 Len=205 [TCP segment of a reassembled PDU]",
167,38.15775749,13.211.139.52,10.42.0.250,TCP,54,3000  >  53522 [ACK] Seq=3921 Ack=2395 Win=60333 Len=0,0.259253058
168,38.40383976,10.42.0.250,13.211.139.52,HTTP/JSON,121,"POST /data HTTP/1.1 , JavaScript Object Notation (application/json)",
169,38.57814927,13.211.139.52,10.42.0.250,TCP,54,3000  >  53522 [ACK] Seq=3921 Ack=2462 Win=60266 Len=0,0.174309512
170,38.64303288,13.211.139.52,10.42.0.250,HTTP/JSON,446,"HTTP/1.1 200 OK , JavaScript Object Notation (application/json)",
172,38.75442635,10.42.0.250,13.211.139.52,TCP,54,53522  >  3000 [ACK] Seq=2462 Ack=4313 Win=4584 Len=0,0.111393471
177,38.97108744,54.253.71.217,10.42.0.250,TCP,54,8883  >  53521 [ACK] Seq=5637 Ack=2370 Win=30660 Len=0,0.236776625
178,39.68464345,90.130.70.73,10.42.0.250,TCP,1490,80  >  52134 [ACK] Seq=1 Ack=1 Win=30016 Len=1436,
179,39.73546734,10.42.0.250,90.130.70.73,TCP,54,"52134  >  80 [RST, ACK] Seq=1 Ack=1437 Win=32790 Len=0",0.050823889
180,40.74749371,10.42.0.250,13.211.139.52,TCP,259,"53522  >  3000 [PSH, ACK] Seq=2462 Ack=4313 Win=4584 Len=205 [TCP segment of a reassembled PDU]",
181,40.96852356,13.211.139.52,10.42.0.250,TCP,54,3000  >  53522 [ACK] Seq=4313 Ack=2667 Win=60061 Len=0,0.221029846
182,41.16787699,10.42.0.250,13.211.139.52,HTTP/JSON,121,"POST /data HTTP/1.1 , JavaScript Object Notation (application/json)",
183,41.37669848,13.211.139.52,10.42.0.250,TCP,54,3000  >  53522 [ACK] Seq=4313 Ack=2734 Win=59994 Len=0,0.208821495
184,41.38514464,13.211.139.52,10.42.0.250,HTTP/JSON,446,"HTTP/1.1 200 OK , JavaScript Object Notation (application/json)",
185,41.69089259,10.42.0.250,13.211.139.52,TCP,54,53522  >  3000 [ACK] Seq=2734 Ack=4705 Win=5760 Len=0,0.305747949
189,42.25728783,54.253.71.217,10.42.0.250,TCP,54,8883  >  53521 [ACK] Seq=5637 Ack=2479 Win=30660 Len=0,0.552904301
192,43.72800618,10.42.0.250,13.211.139.52,TCP,259,"53522  >  3000 [PSH, ACK] Seq=2734 Ack=4705 Win=5760 Len=205 [TCP segment of a reassembled PDU]",
193,43.9039615,13.211.139.52,10.42.0.250,TCP,54,3000  >  53522 [ACK] Seq=4705 Ack=2939 Win=59789 Len=0,0.175955323
194,44.13790838,10.42.0.250,13.211.139.52,HTTP/JSON,121,"POST /data HTTP/1.1 , JavaScript Object Notation (application/json)",
195,44.31189989,13.211.139.52,10.42.0.250,TCP,54,3000  >  53522 [ACK] Seq=4705 Ack=3006 Win=59722 Len=0,0.173991509
196,44.36135791,13.211.139.52,10.42.0.250,HTTP/JSON,446,"HTTP/1.1 200 OK , JavaScript Object Notation (application/json)",
198,44.50437217,10.42.0.250,13.211.139.52,TCP,54,53522  >  3000 [ACK] Seq=3006 Ack=5097 Win=5368 Len=0,0.143014261
199,44.63586189,54.253.71.217,10.42.0.250,TCP,54,8883  >  53521 [ACK] Seq=5637 Ack=2588 Win=30660 Len=0,0.173525963
200,46.47570962,10.42.0.250,13.211.139.52,TCP,259,"53522  >  3000 [PSH, ACK] Seq=3006 Ack=5097 Win=5368 Len=205 [TCP segment of a reassembled PDU]",
201,46.65946198,13.211.139.52,10.42.0.250,TCP,54,3000  >  53522 [ACK] Seq=5097 Ack=3211 Win=59517 Len=0,0.183752366
202,46.69773895,10.42.0.250,13.211.139.52,HTTP/JSON,121,"POST /data HTTP/1.1 , JavaScript Object Notation (application/json)",
203,46.87356163,13.211.139.52,10.42.0.250,TCP,54,3000  >  53522 [ACK] Seq=5097 Ack=3278 Win=59450 Len=0,0.175822672
204,46.92154316,13.211.139.52,10.42.0.250,HTTP/JSON,446,"HTTP/1.1 200 OK , JavaScript Object Notation (application/json)",
206,47.00686365,10.42.0.250,13.211.139.52,TCP,54,53522  >  3000 [ACK] Seq=3278 Ack=5489 Win=4976 Len=0,0.085320489
207,47.11679295,54.253.71.217,10.42.0.250,TCP,54,8883  >  53521 [ACK] Seq=5637 Ack=2697 Win=30660 Len=0,0.17545825
209,48.95562818,10.42.0.250,13.211.139.52,TCP,259,"53522  >  3000 [PSH, ACK] Seq=3278 Ack=5489 Win=4976 Len=205 [TCP segment of a reassembled PDU]",
210,49.12776816,54.253.71.217,10.42.0.250,TCP,54,8883  >  53521 [ACK] Seq=5637 Ack=2728 Win=30660 Len=0,0.173875804
212,49.12782142,13.211.139.52,10.42.0.250,TCP,54,3000  >  53522 [ACK] Seq=5489 Ack=3483 Win=59245 Len=0,0.172193248
213,49.15654868,10.42.0.250,13.211.139.52,HTTP/JSON,121,"POST /data HTTP/1.1 , JavaScript Object Notation (application/json)",
214,49.25574964,10.42.0.250,54.253.71.217,TCP,54,53521  >  8883 [ACK] Seq=2728 Ack=5668 Win=5217 Len=0,0.127937379
215,49.32901149,13.211.139.52,10.42.0.250,TCP,54,3000  >  53522 [ACK] Seq=5489 Ack=3550 Win=59178 Len=0,0.17246281
216,49.36142528,13.211.139.52,10.42.0.250,HTTP/JSON,446,"HTTP/1.1 200 OK , JavaScript Object Notation (application/json)",
218,49.50653825,10.42.0.250,13.211.139.52,TCP,54,53522  >  3000 [ACK] Seq=3550 Ack=5881 Win=4584 Len=0,0.145112973
219,49.59523097,54.253.71.217,10.42.0.250,TCP,54,8883  >  53521 [ACK] Seq=5668 Ack=2837 Win=30660 Len=0,0.213376912
220,51.39491214,10.42.0.250,13.211.139.52,TCP,259,"53522  >  3000 [PSH, ACK] Seq=3550 Ack=5881 Win=4584 Len=205 [TCP segment of a reassembled PDU]",
221,51.61287796,13.211.139.52,10.42.0.250,TCP,54,3000  >  53522 [ACK] Seq=5881 Ack=3755 Win=58973 Len=0,0.217965821
222,51.81960142,10.42.0.250,13.211.139.52,HTTP/JSON,121,"POST /data HTTP/1.1 , JavaScript Object Notation (application/json)",
223,51.99454849,13.211.139.52,10.42.0.250,TCP,54,3000  >  53522 [ACK] Seq=5881 Ack=3822 Win=58906 Len=0,0.174947073
224,52.02217949,13.211.139.52,10.42.0.250,HTTP/JSON,446,"HTTP/1.1 200 OK , JavaScript Object Notation (application/json)",
225,52.03787971,10.42.0.250,13.211.139.52,TCP,54,53522  >  3000 [ACK] Seq=3822 Ack=6273 Win=5760 Len=0,0.015700217
227,52.22632407,54.253.71.217,10.42.0.250,TCP,54,8883  >  53521 [ACK] Seq=5668 Ack=2946 Win=30660 Len=0,0.174561946
228,54.07180052,10.42.0.250,13.211.139.52,TCP,259,"53522  >  3000 [PSH, ACK] Seq=3822 Ack=6273 Win=5760 Len=205 [TCP segment of a reassembled PDU]",
229,54.28875888,13.211.139.52,10.42.0.250,TCP,54,3000  >  53522 [ACK] Seq=6273 Ack=4027 Win=58701 Len=0,0.216958359
230,54.37642675,10.42.0.250,13.211.139.52,HTTP/JSON,121,"POST /data HTTP/1.1 , JavaScript Object Notation (application/json)",
231,54.56548705,13.211.139.52,10.42.0.250,TCP,54,3000  >  53522 [ACK] Seq=6273 Ack=4094 Win=58634 Len=0,0.189060304
232,54.58138728,13.211.139.52,10.42.0.250,HTTP/JSON,446,"HTTP/1.1 200 OK , JavaScript Object Notation (application/json)",
234,55.00787032,10.42.0.250,13.211.139.52,TCP,54,53522  >  3000 [ACK] Seq=4094 Ack=6665 Win=5368 Len=0,0.426483048
235,55.04518916,54.253.71.217,10.42.0.250,TCP,54,8883  >  53521 [ACK] Seq=5668 Ack=3055 Win=30660 Len=0,0.214941164
236,56.82389246,10.42.0.250,13.211.139.52,TCP,259,"53522  >  3000 [PSH, ACK] Seq=4094 Ack=6665 Win=5368 Len=205 [TCP segment of a reassembled PDU]",
237,57.40210789,13.211.139.52,10.42.0.250,TCP,54,3000  >  53522 [ACK] Seq=6665 Ack=4299 Win=58429 Len=0,0.578215422
238,57.75673511,10.42.0.250,13.211.139.52,HTTP/JSON,121,"POST /data HTTP/1.1 , JavaScript Object Notation (application/json)",
239,58.01279522,13.211.139.52,10.42.0.250,TCP,54,3000  >  53522 [ACK] Seq=6665 Ack=4366 Win=58362 Len=0,0.256060106
240,58.2839602,13.211.139.52,10.42.0.250,HTTP/JSON,446,"HTTP/1.1 200 OK , JavaScript Object Notation (application/json)",
242,58.50878822,10.42.0.250,13.211.139.52,TCP,54,53522  >  3000 [ACK] Seq=4366 Ack=7057 Win=4976 Len=0,0.224828018
243,58.71917303,54.253.71.217,10.42.0.250,TCP,54,8883  >  53521 [ACK] Seq=5668 Ack=3164 Win=30660 Len=0,0.331501247
244,60.40288274,10.42.0.250,13.211.139.52,TCP,259,"53522  >  3000 [PSH, ACK] Seq=4366 Ack=7057 Win=4976 Len=205 [TCP segment of a reassembled PDU]",
245,60.88227476,13.211.139.52,10.42.0.250,TCP,54,3000  >  53522 [ACK] Seq=7057 Ack=4571 Win=58157 Len=0,0.479392023
246,61.55073336,10.42.0.250,13.211.139.52,HTTP/JSON,121,"POST /data HTTP/1.1 , JavaScript Object Notation (application/json)",
247,61.88002824,13.211.139.52,10.42.0.250,TCP,54,3000  >  53522 [ACK] Seq=7057 Ack=4638 Win=58090 Len=0,0.329294882
248,61.88042013,13.211.139.52,10.42.0.250,HTTP/JSON,446,"HTTP/1.1 200 OK , JavaScript Object Notation (application/json)",
250,62.25909926,54.253.71.217,10.42.0.250,TCP,54,8883  >  53521 [ACK] Seq=5668 Ack=3273 Win=30660 Len=0,0.171811048
251,62.26700987,10.42.0.250,13.211.139.52,TCP,54,53522  >  3000 [ACK] Seq=4638 Ack=7449 Win=4584 Len=0,0.386589739
252,64.10189412,10.42.0.250,13.211.139.52,TCP,260,"53522  >  3000 [PSH, ACK] Seq=4638 Ack=7449 Win=4584 Len=206 [TCP segment of a reassembled PDU]",
253,64.31566379,13.211.139.52,10.42.0.250,TCP,54,3000  >  53522 [ACK] Seq=7449 Ack=4844 Win=57884 Len=0,0.213769661
254,64.63339627,10.42.0.250,13.211.139.52,HTTP/JSON,171,"POST /data HTTP/1.1 , JavaScript Object Notation (application/json)",
255,64.80540954,13.211.139.52,10.42.0.250,TCP,54,3000  >  53522 [ACK] Seq=7449 Ack=4961 Win=57767 Len=0,0.172013269
256,64.83996243,13.211.139.52,10.42.0.250,HTTP/JSON,446,"HTTP/1.1 200 OK , JavaScript Object Notation (application/json)",
257,64.93102639,10.42.0.250,13.211.139.52,TCP,54,53522  >  3000 [ACK] Seq=4961 Ack=7841 Win=5760 Len=0,0.09106396
259,65.11696705,54.253.71.217,10.42.0.250,TCP,54,8883  >  53521 [ACK] Seq=5668 Ack=3433 Win=32412 Len=0,0.171404516
263,66.97236926,10.42.0.250,13.211.139.52,TCP,260,"53522  >  3000 [PSH, ACK] Seq=4961 Ack=7841 Win=5760 Len=206 [TCP segment of a reassembled PDU]",
264,67.14553031,54.253.71.217,10.42.0.250,TCP,54,8883  >  53521 [ACK] Seq=5668 Ack=3464 Win=32412 Len=0,0.173161451
266,67.18780773,13.211.139.52,10.42.0.250,TCP,54,3000  >  53522 [ACK] Seq=7841 Ack=5167 Win=57561 Len=0,0.215438469
267,67.1895883,10.42.0.250,13.211.139.52,HTTP/JSON,171,"POST /data HTTP/1.1 , JavaScript Object Notation (application/json)",
268,67.26089648,10.42.0.250,54.253.71.217,TCP,54,53521  >  8883 [ACK] Seq=3464 Ack=5699 Win=5186 Len=0,0.115338452
269,67.36452845,13.211.139.52,10.42.0.250,TCP,54,3000  >  53522 [ACK] Seq=7841 Ack=5284 Win=57444 Len=0,0.174940151
270,67.39613021,13.211.139.52,10.42.0.250,HTTP/JSON,446,"HTTP/1.1 200 OK , JavaScript Object Notation (application/json)",
272,67.51186738,10.42.0.250,13.211.139.52,TCP,54,53522  >  3000 [ACK] Seq=5284 Ack=8233 Win=5368 Len=0,0.11573717
273,67.62904741,54.253.71.217,10.42.0.250,TCP,54,8883  >  53521 [ACK] Seq=5699 Ack=3624 Win=34164 Len=0,0.213941894
274,69.43927728,10.42.0.250,13.211.139.52,TCP,260,"53522  >  3000 [PSH, ACK] Seq=5284 Ack=8233 Win=5368 Len=206 [TCP segment of a reassembled PDU]",
275,69.66094093,13.211.139.52,10.42.0.250,TCP,54,3000  >  53522 [ACK] Seq=8233 Ack=5490 Win=57238 Len=0,0.221663651
276,69.84068767,10.42.0.250,13.211.139.52,HTTP/JSON,171,"POST /data HTTP/1.1 , JavaScript Object Notation (application/json)",
277,70.01411178,13.211.139.52,10.42.0.250,TCP,54,3000  >  53522 [ACK] Seq=8233 Ack=5607 Win=57121 Len=0,0.173424114
278,70.04002895,13.211.139.52,10.42.0.250,HTTP/JSON,446,"HTTP/1.1 200 OK , JavaScript Object Notation (application/json)",
280,70.23729635,54.253.71.217,10.42.0.250,TCP,54,8883  >  53521 [ACK] Seq=5699 Ack=3784 Win=35916 Len=0,0.172174142
281,70.26284554,10.42.0.250,13.211.139.52,TCP,54,53522  >  3000 [ACK] Seq=5607 Ack=8625 Win=4976 Len=0,0.222816593
282,72.09363361,10.42.0.250,13.211.139.52,TCP,260,"53522  >  3000 [PSH, ACK] Seq=5607 Ack=8625 Win=4976 Len=206 [TCP segment of a reassembled PDU]",
283,72.40084195,13.211.139.52,10.42.0.250,TCP,54,3000  >  53522 [ACK] Seq=8625 Ack=5813 Win=56915 Len=0,0.307208337
284,72.50325593,10.42.0.250,13.211.139.52,HTTP/JSON,171,"POST /data HTTP/1.1 , JavaScript Object Notation (application/json)",
285,72.84093381,13.211.139.52,10.42.0.250,TCP,54,3000  >  53522 [ACK] Seq=8625 Ack=5930 Win=56798 Len=0,0.337677889
286,72.84094635,13.211.139.52,10.42.0.250,HTTP/JSON,446,"HTTP/1.1 200 OK , JavaScript Object Notation (application/json)",
288,73.02380263,10.42.0.250,13.211.139.52,TCP,54,53522  >  3000 [ACK] Seq=5930 Ack=9017 Win=4584 Len=0,0.182856283
289,73.28687404,54.253.71.217,10.42.0.250,TCP,54,8883  >  53521 [ACK] Seq=5699 Ack=3944 Win=37668 Len=0,0.353208687
290,74.95770831,10.42.0.250,13.211.139.52,TCP,260,"53522  >  3000 [PSH, ACK] Seq=5930 Ack=9017 Win=4584 Len=206 [TCP segment of a reassembled PDU]",
293,75.42570302,13.211.139.52,10.42.0.250,TCP,54,3000  >  53522 [ACK] Seq=9017 Ack=6136 Win=56592 Len=0,0.467994708
294,75.57275489,10.42.0.250,13.211.139.52,HTTP/JSON,171,"POST /data HTTP/1.1 , JavaScript Object Notation (application/json)",
295,75.88082352,13.211.139.52,10.42.0.250,TCP,54,3000  >  53522 [ACK] Seq=9017 Ack=6253 Win=56475 Len=0,0.308068639
296,75.88084411,13.211.139.52,10.42.0.250,HTTP/JSON,446,"HTTP/1.1 200 OK , JavaScript Object Notation (application/json)",
297,76.1986309,10.42.0.250,13.211.139.52,TCP,54,53522  >  3000 [ACK] Seq=6253 Ack=9409 Win=5760 Len=0,0.317786794
299,76.54750324,54.253.71.217,10.42.0.250,TCP,54,8883  >  53521 [ACK] Seq=5699 Ack=4104 Win=39420 Len=0,0.335724454
300,78.23604954,10.42.0.250,13.211.139.52,TCP,260,"53522  >  3000 [PSH, ACK] Seq=6253 Ack=9409 Win=5760 Len=206 [TCP segment of a reassembled PDU]",
301,78.45234021,13.211.139.52,10.42.0.250,TCP,54,3000  >  53522 [ACK] Seq=9409 Ack=6459 Win=56475 Len=0,0.216290669
302,78.6446672,10.42.0.250,13.211.139.52,HTTP/JSON,171,"POST /data HTTP/1.1 , JavaScript Object Notation (application/json)",
303,78.81820376,13.211.139.52,10.42.0.250,TCP,54,3000  >  53522 [ACK] Seq=9409 Ack=6576 Win=56475 Len=0,0.173536562
304,78.86468749,13.211.139.52,10.42.0.250,HTTP/JSON,446,"HTTP/1.1 200 OK , JavaScript Object Notation (application/json)",
306,79.01747878,10.42.0.250,13.211.139.52,TCP,54,53522  >  3000 [ACK] Seq=6576 Ack=9801 Win=5368 Len=0,0.152791291
307,79.05739207,54.253.71.217,10.42.0.250,TCP,54,8883  >  53521 [ACK] Seq=5699 Ack=4264 Win=41172 Len=0,0.173425533
308,80.90480074,10.42.0.250,13.211.139.52,TCP,260,"53522  >  3000 [PSH, ACK] Seq=6576 Ack=9801 Win=5368 Len=206 [TCP segment of a reassembled PDU]",
311,81.0766595,13.211.139.52,10.42.0.250,TCP,54,3000  >  53522 [ACK] Seq=9801 Ack=6782 Win=56475 Len=0,0.171858763
312,81.10542248,10.42.0.250,13.211.139.52,HTTP/JSON,171,"POST /data HTTP/1.1 , JavaScript Object Notation (application/json)",
313,81.35116706,13.211.139.52,10.42.0.250,TCP,54,3000  >  53522 [ACK] Seq=9801 Ack=6899 Win=56475 Len=0,0.245744578
314,81.35119367,13.211.139.52,10.42.0.250,HTTP/JSON,446,"HTTP/1.1 200 OK , JavaScript Object Notation (application/json)",
319,81.51498405,10.42.0.250,13.211.139.52,TCP,54,53522  >  3000 [ACK] Seq=6899 Ack=10193 Win=4976 Len=0,0.163790383
321,81.70460232,54.253.71.217,10.42.0.250,TCP,54,8883  >  53521 [ACK] Seq=5699 Ack=4424 Win=42924 Len=0,0.174404316
326,83.55371685,10.42.0.250,13.211.139.52,TCP,260,"53522  >  3000 [PSH, ACK] Seq=6899 Ack=10193 Win=4976 Len=206 [TCP segment of a reassembled PDU]",
327,83.77136249,13.211.139.52,10.42.0.250,TCP,54,3000  >  53522 [ACK] Seq=10193 Ack=7105 Win=56475 Len=0,0.217645646
328,83.87056095,10.42.0.250,13.211.139.52,HTTP/JSON,171,"POST /data HTTP/1.1 , JavaScript Object Notation (application/json)",
329,84.04447694,13.211.139.52,10.42.0.250,TCP,54,3000  >  53522 [ACK] Seq=10193 Ack=7222 Win=56475 Len=0,0.173915987
330,84.08041754,13.211.139.52,10.42.0.250,HTTP/JSON,446,"HTTP/1.1 200 OK , JavaScript Object Notation (application/json)",
332,84.26643855,10.42.0.250,13.211.139.52,TCP,54,53522  >  3000 [ACK] Seq=7222 Ack=10585 Win=4584 Len=0,0.186021016
333,84.3738236,54.253.71.217,10.42.0.250,TCP,54,8883  >  53521 [ACK] Seq=5699 Ack=4584 Win=44676 Len=0,0.172790296
339,86.22347913,10.42.0.250,13.211.139.52,TCP,260,"53522  >  3000 [PSH, ACK] Seq=7222 Ack=10585 Win=4584 Len=206 [TCP segment of a reassembled PDU]",
340,86.58776082,54.253.71.217,10.42.0.250,TCP,54,8883  >  53521 [ACK] Seq=5699 Ack=4615 Win=44676 Len=0,0.366123636
342,86.58780729,13.211.139.52,10.42.0.250,TCP,54,3000  >  53522 [ACK] Seq=10585 Ack=7428 Win=56475 Len=0,0.364328152
343,86.63508752,10.42.0.250,13.211.139.52,HTTP/JSON,171,"POST /data HTTP/1.1 , JavaScript Object Notation (application/json)",
344,86.76645895,10.42.0.250,54.253.71.217,TCP,54,53521  >  8883 [ACK] Seq=4615 Ack=5730 Win=5155 Len=0,0.178662747
347,87.4019024,13.211.139.52,10.42.0.250,TCP,54,3000  >  53522 [ACK] Seq=10585 Ack=7545 Win=56475 Len=0,0.766814882
348,87.40194342,13.211.139.52,10.42.0.250,HTTP/JSON,446,"HTTP/1.1 200 OK , JavaScript Object Notation (application/json)",
349,87.4544893,10.42.0.250,13.211.139.52,TCP,54,53522  >  3000 [ACK] Seq=7545 Ack=10977 Win=5760 Len=0,0.052545875
351,87.83988728,54.253.71.217,10.42.0.250,TCP,54,8883  >  53521 [ACK] Seq=5730 Ack=4775 Win=46428 Len=0,0.370566934
352,89.49847556,10.42.0.250,13.211.139.52,TCP,260,"53522  >  3000 [PSH, ACK] Seq=7545 Ack=10977 Win=5760 Len=206 [TCP segment of a reassembled PDU]",
353,89.97588114,13.211.139.52,10.42.0.250,TCP,54,3000  >  53522 [ACK] Seq=10977 Ack=7751 Win=56475 Len=0,0.477405571
354,90.01355139,10.42.0.250,13.211.139.52,HTTP/JSON,171,"POST /data HTTP/1.1 , JavaScript Object Notation (application/json)",
359,90.41643265,13.211.139.52,10.42.0.250,TCP,54,3000  >  53522 [ACK] Seq=10977 Ack=7868 Win=56475 Len=0,0.402881259
360,90.41644917,13.211.139.52,10.42.0.250,HTTP/JSON,446,"HTTP/1.1 200 OK , JavaScript Object Notation (application/json)",
362,90.767627,10.42.0.250,13.211.139.52,TCP,54,53522  >  3000 [ACK] Seq=7868 Ack=11369 Win=5368 Len=0,0.351177824
363,90.90230658,54.253.71.217,10.42.0.250,TCP,54,8883  >  53521 [ACK] Seq=5730 Ack=4935 Win=48180 Len=0,0.353839155
368,92.5722209,10.42.0.250,13.211.139.52,TCP,260,"53522  >  3000 [PSH, ACK] Seq=7868 Ack=11369 Win=5368 Len=206 [TCP segment of a reassembled PDU]",
369,92.79220231,13.211.139.52,10.42.0.250,TCP,54,3000  >  53522 [ACK] Seq=11369 Ack=8074 Win=56475 Len=0,0.219981416
370,92.98268592,10.42.0.250,13.211.139.52,HTTP/JSON,230,"POST /data HTTP/1.1 , JavaScript Object Notation (application/json)",
371,93.15639108,13.211.139.52,10.42.0.250,TCP,54,3000  >  53522 [ACK] Seq=11369 Ack=8250 Win=56475 Len=0,0.173705166
372,93.19983864,13.211.139.52,10.42.0.250,HTTP/JSON,446,"HTTP/1.1 200 OK , JavaScript Object Notation (application/json)",
374,93.26819008,10.42.0.250,13.211.139.52,TCP,54,53522  >  3000 [ACK] Seq=8250 Ack=11761 Win=4976 Len=0,0.068351435
376,93.39839435,54.253.71.217,10.42.0.250,TCP,54,8883  >  53521 [ACK] Seq=5730 Ack=5154 Win=49932 Len=0,0.180735489
378,95.24191588,10.42.0.250,13.211.139.52,TCP,260,"53522  >  3000 [PSH, ACK] Seq=8250 Ack=11761 Win=4976 Len=206 [TCP segment of a reassembled PDU]",
380,95.41671037,13.211.139.52,10.42.0.250,TCP,54,3000  >  53522 [ACK] Seq=11761 Ack=8456 Win=56475 Len=0,0.174794482
381,95.44149498,10.42.0.250,13.211.139.52,HTTP/JSON,230,"POST /data HTTP/1.1 , JavaScript Object Notation (application/json)",
386,95.61443535,13.211.139.52,10.42.0.250,TCP,54,3000  >  53522 [ACK] Seq=11761 Ack=8632 Win=56475 Len=0,0.172940368
387,95.64511551,13.211.139.52,10.42.0.250,HTTP/JSON,446,"HTTP/1.1 200 OK , JavaScript Object Notation (application/json)",
389,95.7686929,10.42.0.250,13.211.139.52,TCP,54,53522  >  3000 [ACK] Seq=8632 Ack=12153 Win=4584 Len=0,0.123577391
390,95.84054016,54.253.71.217,10.42.0.250,TCP,54,8883  >  53521 [ACK] Seq=5730 Ack=5373 Win=51684 Len=0,0.172892153
394,97.69156157,10.42.0.250,13.211.139.52,TCP,260,"53522  >  3000 [PSH, ACK] Seq=8632 Ack=12153 Win=4584 Len=206 [TCP segment of a reassembled PDU]",
395,97.96500472,13.211.139.52,10.42.0.250,TCP,54,3000  >  53522 [ACK] Seq=12153 Ack=8838 Win=56475 Len=0,0.273443149
396,98.00017653,10.42.0.250,13.211.139.52,HTTP/JSON,230,"POST /data HTTP/1.1 , JavaScript Object Notation (application/json)",
397,98.17384018,13.211.139.52,10.42.0.250,TCP,54,3000  >  53522 [ACK] Seq=12153 Ack=9014 Win=56475 Len=0,0.173663648
398,98.20238077,13.211.139.52,10.42.0.250,HTTP/JSON,446,"HTTP/1.1 200 OK , JavaScript Object Notation (application/json)",
399,98.31274576,10.42.0.250,13.211.139.52,TCP,54,53522  >  3000 [ACK] Seq=9014 Ack=12545 Win=5760 Len=0,0.110364997
401,98.50145974,54.253.71.217,10.42.0.250,TCP,54,8883  >  53521 [ACK] Seq=5730 Ack=5592 Win=53436 Len=0,0.174171592
402,100.3510247,10.42.0.250,13.211.139.52,TCP,260,"53522  >  3000 [PSH, ACK] Seq=9014 Ack=12545 Win=5760 Len=206 [TCP segment of a reassembled PDU]",
403,100.5767182,13.211.139.52,10.42.0.250,TCP,54,3000  >  53522 [ACK] Seq=12545 Ack=9220 Win=56475 Len=0,0.225693466
404,100.7639871,10.42.0.250,13.211.139.52,HTTP/JSON,230,"POST /data HTTP/1.1 , JavaScript Object Notation (application/json)",
405,100.9383855,13.211.139.52,10.42.0.250,TCP,54,3000  >  53522 [ACK] Seq=12545 Ack=9396 Win=56475 Len=0,0.174398349
406,100.9850753,13.211.139.52,10.42.0.250,HTTP/JSON,446,"HTTP/1.1 200 OK , JavaScript Object Notation (application/json)",
408,101.0192564,10.42.0.250,13.211.139.52,TCP,54,53522  >  3000 [ACK] Seq=9396 Ack=12937 Win=5368 Len=0,0.034181162
409,101.2526255,54.253.71.217,10.42.0.250,TCP,54,8883  >  53521 [ACK] Seq=5730 Ack=5811 Win=55188 Len=0,0.244444862
410,103.0668715,10.42.0.250,13.211.139.52,TCP,260,"53522  >  3000 [PSH, ACK] Seq=9396 Ack=12937 Win=5368 Len=206 [TCP segment of a reassembled PDU]",
411,103.4662035,13.211.139.52,10.42.0.250,TCP,54,3000  >  53522 [ACK] Seq=12937 Ack=9602 Win=56475 Len=0,0.399331975
412,103.6304337,10.42.0.250,13.211.139.52,HTTP/JSON,230,"POST /data HTTP/1.1 , JavaScript Object Notation (application/json)",
414,104.1654994,13.211.139.52,10.42.0.250,TCP,54,3000  >  53522 [ACK] Seq=12937 Ack=9778 Win=56475 Len=0,0.535065642
415,104.1655409,13.211.139.52,10.42.0.250,HTTP/JSON,446,"HTTP/1.1 200 OK , JavaScript Object Notation (application/json)",
417,104.2693683,10.42.0.250,13.211.139.52,TCP,54,53522  >  3000 [ACK] Seq=9778 Ack=13329 Win=4976 Len=0,0.103827441
418,104.5752713,54.253.71.217,10.42.0.250,TCP,54,8883  >  53521 [ACK] Seq=5730 Ack=6030 Win=56940 Len=0,0.308425798
421,106.292893,10.42.0.250,13.211.139.52,TCP,260,"53522  >  3000 [PSH, ACK] Seq=9778 Ack=13329 Win=4976 Len=206 [TCP segment of a reassembled PDU]",
423,106.554642,54.253.71.217,10.42.0.250,TCP,54,8883  >  53521 [ACK] Seq=5730 Ack=6061 Win=56940 Len=0,0.264492345
425,106.5673456,13.211.139.52,10.42.0.250,TCP,54,3000  >  53522 [ACK] Seq=13329 Ack=9984 Win=56475 Len=0,0.274452661
426,106.7037617,10.42.0.250,13.211.139.52,HTTP/JSON,230,"POST /data HTTP/1.1 , JavaScript Object Notation (application/json)",
427,106.769932,10.42.0.250,54.253.71.217,TCP,54,53521  >  8883 [ACK] Seq=6061 Ack=5761 Win=5124 Len=0,0.202613489
428,107.0631271,13.211.139.52,10.42.0.250,TCP,54,3000  >  53522 [ACK] Seq=13329 Ack=10160 Win=56475 Len=0,0.359365389
429,107.1060203,13.211.139.52,10.42.0.250,HTTP/JSON,446,"HTTP/1.1 200 OK , JavaScript Object Notation (application/json)",
431,107.2743289,10.42.0.250,13.211.139.52,TCP,54,53522  >  3000 [ACK] Seq=10160 Ack=13721 Win=4584 Len=0,0.168308664
432,107.3441731,54.253.71.217,10.42.0.250,TCP,54,8883  >  53521 [ACK] Seq=5761 Ack=6280 Win=58692 Len=0,0.215955316
433,109.153726,10.42.0.250,13.211.139.52,TCP,260,"53522  >  3000 [PSH, ACK] Seq=10160 Ack=13721 Win=4584 Len=206 [TCP segment of a reassembled PDU]",
434,109.3294097,13.211.139.52,10.42.0.250,TCP,54,3000  >  53522 [ACK] Seq=13721 Ack=10366 Win=56475 Len=0,0.175683678
435,109.3669585,10.42.0.250,13.211.139.52,HTTP/JSON,230,"POST /data HTTP/1.1 , JavaScript Object Notation (application/json)",
436,109.5411944,13.211.139.52,10.42.0.250,TCP,54,3000  >  53522 [ACK] Seq=13721 Ack=10542 Win=56475 Len=0,0.174235931
437,109.5831266,13.211.139.52,10.42.0.250,HTTP/JSON,446,"HTTP/1.1 200 OK , JavaScript Object Notation (application/json)",
438,109.5940277,10.42.0.250,13.211.139.52,TCP,54,53522  >  3000 [ACK] Seq=10542 Ack=14113 Win=5760 Len=0,0.010901158
440,109.7829206,54.253.71.217,10.42.0.250,TCP,54,8883  >  53521 [ACK] Seq=5761 Ack=6499 Win=60444 Len=0,0.174382611
441,111.6323318,10.42.0.250,13.211.139.52,TCP,260,"53522  >  3000 [PSH, ACK] Seq=10542 Ack=14113 Win=5760 Len=206 [TCP segment of a reassembled PDU]",
442,111.8477145,13.211.139.52,10.42.0.250,TCP,54,3000  >  53522 [ACK] Seq=14113 Ack=10748 Win=56475 Len=0,0.215382711
443,112.0297322,10.42.0.250,13.211.139.52,HTTP/JSON,230,"POST /data HTTP/1.1 , JavaScript Object Notation (application/json)",
444,112.2036013,13.211.139.52,10.42.0.250,TCP,54,3000  >  53522 [ACK] Seq=14113 Ack=10924 Win=56475 Len=0,0.173869107
445,112.2458166,13.211.139.52,10.42.0.250,HTTP/JSON,446,"HTTP/1.1 200 OK , JavaScript Object Notation (application/json)",
447,112.2714991,10.42.0.250,13.211.139.52,TCP,54,53522  >  3000 [ACK] Seq=10924 Ack=14505 Win=5368 Len=0,0.025682507
448,112.4437747,54.253.71.217,10.42.0.250,TCP,54,8883  >  53521 [ACK] Seq=5761 Ack=6718 Win=62196 Len=0,0.175725906
449,114.2924173,10.42.0.250,13.211.139.52,TCP,260,"53522  >  3000 [PSH, ACK] Seq=10924 Ack=14505 Win=5368 Len=206 [TCP segment of a reassembled PDU]",
450,114.5069026,13.211.139.52,10.42.0.250,TCP,54,3000  >  53522 [ACK] Seq=14505 Ack=11130 Win=56475 Len=0,0.214485277
451,114.7923818,10.42.0.250,13.211.139.52,HTTP/JSON,230,"POST /data HTTP/1.1 , JavaScript Object Notation (application/json)",
452,114.9663902,13.211.139.52,10.42.0.250,TCP,54,3000  >  53522 [ACK] Seq=14505 Ack=11306 Win=56475 Len=0,0.174008382
453,115.0245176,13.211.139.52,10.42.0.250,HTTP/JSON,446,"HTTP/1.1 200 OK , JavaScript Object Notation (application/json)",
455,115.2721142,10.42.0.250,13.211.139.52,TCP,54,53522  >  3000 [ACK] Seq=11306 Ack=14897 Win=4976 Len=0,0.247596541
456,115.2926817,54.253.71.217,10.42.0.250,TCP,54,8883  >  53521 [ACK] Seq=5761 Ack=6937 Win=63948 Len=0,0.174197305
457,117.1420777,10.42.0.250,13.211.139.52,TCP,260,"53522  >  3000 [PSH, ACK] Seq=11306 Ack=14897 Win=4976 Len=206 [TCP segment of a reassembled PDU]",
458,117.4019656,13.211.139.52,10.42.0.250,TCP,54,3000  >  53522 [ACK] Seq=14897 Ack=11512 Win=56475 Len=0,0.259887952
459,117.5568928,10.42.0.250,13.211.139.52,HTTP/JSON,230,"POST /data HTTP/1.1 , JavaScript Object Notation (application/json)",
460,117.8455316,13.211.139.52,10.42.0.250,TCP,54,3000  >  53522 [ACK] Seq=14897 Ack=11688 Win=56475 Len=0,0.288638871
461,117.8455929,13.211.139.52,10.42.0.250,HTTP/JSON,446,"HTTP/1.1 200 OK , JavaScript Object Notation (application/json)",
463,118.0225907,10.42.0.250,13.211.139.52,TCP,54,53522  >  3000 [ACK] Seq=11688 Ack=15289 Win=4584 Len=0,0.176997768
464,118.2900317,54.253.71.217,10.42.0.250,TCP,54,8883  >  53521 [ACK] Seq=5761 Ack=7156 Win=64824 Len=0,0.302988305
465,120.0153389,10.42.0.250,13.211.139.52,TCP,260,"53522  >  3000 [PSH, ACK] Seq=11688 Ack=15289 Win=4584 Len=206 [TCP segment of a reassembled PDU]",
466,120.4152546,13.211.139.52,10.42.0.250,TCP,54,3000  >  53522 [ACK] Seq=15289 Ack=11894 Win=56475 Len=0,0.399915691
467,120.425538,10.42.0.250,13.211.139.52,HTTP/JSON,280,"POST /data HTTP/1.1 , JavaScript Object Notation (application/json)",
468,120.6023232,13.211.139.52,10.42.0.250,TCP,54,3000  >  53522 [ACK] Seq=15289 Ack=12120 Win=56475 Len=0,0.176785187
469,120.8808031,13.211.139.52,10.42.0.250,HTTP/JSON,446,"HTTP/1.1 200 OK , JavaScript Object Notation (application/json)",
470,121.0432944,10.42.0.250,13.211.139.52,TCP,54,53522  >  3000 [ACK] Seq=12120 Ack=15681 Win=5760 Len=0,0.162491358
472,121.3769341,54.253.71.217,10.42.0.250,TCP,54,8883  >  53521 [ACK] Seq=5761 Ack=7425 Win=64824 Len=0,0.319110838
473,123.0915582,10.42.0.250,13.211.139.52,TCP,260,"53522  >  3000 [PSH, ACK] Seq=12120 Ack=15681 Win=5760 Len=206 [TCP segment of a reassembled PDU]",
474,123.30813,13.211.139.52,10.42.0.250,TCP,54,3000  >  53522 [ACK] Seq=15681 Ack=12326 Win=56475 Len=0,0.216571797
475,123.4964671,10.42.0.250,13.211.139.52,HTTP/JSON,280,"POST /data HTTP/1.1 , JavaScript Object Notation (application/json)",
476,123.669117,13.211.139.52,10.42.0.250,TCP,54,3000  >  53522 [ACK] Seq=15681 Ack=12552 Win=56475 Len=0,0.172649943
477,123.7190684,13.211.139.52,10.42.0.250,HTTP/JSON,446,"HTTP/1.1 200 OK , JavaScript Object Notation (application/json)",
479,123.7726603,10.42.0.250,13.211.139.52,TCP,54,53522  >  3000 [ACK] Seq=12552 Ack=16073 Win=5368 Len=0,0.053591855
480,123.9102787,54.253.71.217,10.42.0.250,TCP,54,8883  >  53521 [ACK] Seq=5761 Ack=7694 Win=64824 Len=0,0.173015533
484,125.7724799,10.42.0.250,13.211.139.52,TCP,260,"53522  >  3000 [PSH, ACK] Seq=12552 Ack=16073 Win=5368 Len=206 [TCP segment of a reassembled PDU]",
487,126.0726056,54.253.71.217,10.42.0.250,TCP,54,8883  >  53521 [ACK] Seq=5761 Ack=7725 Win=64824 Len=0,0.302755128
489,126.0726324,13.211.139.52,10.42.0.250,TCP,54,3000  >  53522 [ACK] Seq=16073 Ack=12758 Win=56475 Len=0,0.30015249
490,126.1592067,10.42.0.250,13.211.139.52,HTTP/JSON,280,"POST /data HTTP/1.1 , JavaScript Object Notation (application/json)",
491,126.2732182,10.42.0.250,54.253.71.217,TCP,54,53521  >  8883 [ACK] Seq=7725 Ack=5792 Win=5093 Len=0,0.200589308
492,126.5131437,13.211.139.52,10.42.0.250,TCP,54,3000  >  53522 [ACK] Seq=16073 Ack=12984 Win=56475 Len=0,0.353936919
493,126.5132206,13.211.139.52,10.42.0.250,HTTP/JSON,446,"HTTP/1.1 200 OK , JavaScript Object Notation (application/json)",
495,126.7745385,10.42.0.250,13.211.139.52,TCP,54,53522  >  3000 [ACK] Seq=12984 Ack=16465 Win=4976 Len=0,0.261317844
496,126.9498205,54.253.71.217,10.42.0.250,TCP,54,8883  >  53521 [ACK] Seq=5792 Ack=7994 Win=64824 Len=0,0.361206824
497,128.6227192,10.42.0.250,13.211.139.52,TCP,260,"53522  >  3000 [PSH, ACK] Seq=12984 Ack=16465 Win=4976 Len=206 [TCP segment of a reassembled PDU]",
498,128.8201741,13.211.139.52,10.42.0.250,TCP,54,3000  >  53522 [ACK] Seq=16465 Ack=13190 Win=56475 Len=0,0.197454852
499,129.026932,10.42.0.250,13.211.139.52,HTTP/JSON,280,"POST /data HTTP/1.1 , JavaScript Object Notation (application/json)",
500,129.2838859,13.211.139.52,10.42.0.250,TCP,54,3000  >  53522 [ACK] Seq=16465 Ack=13416 Win=56475 Len=0,0.256953894
501,129.6081488,13.211.139.52,10.42.0.250,HTTP/JSON,446,"HTTP/1.1 200 OK , JavaScript Object Notation (application/json)",
503,129.7755174,10.42.0.250,13.211.139.52,TCP,54,53522  >  3000 [ACK] Seq=13416 Ack=16857 Win=4584 Len=0,0.16736862
504,130.1180986,54.253.71.217,10.42.0.250,TCP,54,8883  >  53521 [ACK] Seq=5792 Ack=8263 Win=64824 Len=0,0.458579219
513,131.693435,10.42.0.250,13.211.139.52,TCP,260,"53522  >  3000 [PSH, ACK] Seq=13416 Ack=16857 Win=4584 Len=206 [TCP segment of a reassembled PDU]",
514,131.9945725,13.211.139.52,10.42.0.250,TCP,54,3000  >  53522 [ACK] Seq=16857 Ack=13622 Win=56475 Len=0,0.301137468
515,132.0979432,10.42.0.250,13.211.139.52,HTTP/JSON,280,"POST /data HTTP/1.1 , JavaScript Object Notation (application/json)",
516,132.4040784,13.211.139.52,10.42.0.250,TCP,54,3000  >  53522 [ACK] Seq=16857 Ack=13848 Win=56475 Len=0,0.306135159
517,132.4041329,13.211.139.52,10.42.0.250,HTTP/JSON,446,"HTTP/1.1 200 OK , JavaScript Object Notation (application/json)",
518,132.5151669,10.42.0.250,13.211.139.52,TCP,54,53522  >  3000 [ACK] Seq=13848 Ack=17249 Win=5760 Len=0,0.111033979
520,132.8432236,54.253.71.217,10.42.0.250,TCP,54,8883  >  53521 [ACK] Seq=5792 Ack=8532 Win=64824 Len=0,0.313595224
